title,time,summary
227辆载有人道主义援助物资的卡车进入加沙地带,1月16日 04:17,
瓦努阿图附近海域发生5.5级地震,1月16日 01:03,
No title,No time,
No title,No time,
古特雷斯就巴以冲突百日发表声明 再次呼吁立即停火,1月16日 01:02,
危地马拉附近海域接连发生两次地震,1月16日 00:41,
西班牙东南部发生交通事故 已致1死13伤,1月16日 00:27,
No title,No time,
国际钻石巨头宣布：大规模降价,1月16日 00:22,
No title,No time,
美国大部分地区将遭遇创纪录低温 约1亿人收到风寒警报,1月16日 00:00,
访华归国，马尔代夫总统穆伊兹“对印度强硬表态”,1月15日 22:54,
美军承认：失踪的是海豹突击队员……,1月14日 13:31,
曾打破惯例两次访华，这位“个性女王”退位,1月14日 12:56,
突发！日本地震、火山喷发！,1月14日 09:47,
俄方：在乌部署英军就是宣战！,1月14日 08:59,
巴以冲突将满100天，内塔尼亚胡：没有人可以阻止我们将战斗到底，直至胜利,1月14日 08:58,
俄国防部：完成打击，已摧毁！,1月14日 08:50,
本轮巴以冲突已致加沙地带上万名儿童死亡,1月14日 08:38,
美媒：美国总统气候问题特使克里称将卸任，计划帮助拜登竞选连任,1月14日 08:31,
美英联手空袭，红海局势骤然升级,1月14日 08:04,
英媒：法意西未参加美英对胡塞武装袭击，甚至未签署辩护声明,1月14日 07:22,
以色列总理称将继续在加沙的军事行动 直至取得完全胜利,1月14日 07:21,
胡塞武装谴责美英空袭，称将进行反击,1月14日 07:19,
土耳其国防部称过去24小时内土军方打死57名“恐怖分子”,1月14日 07:16,
联合国近东救济工程处：以方持续轰炸加沙地带致巴勒斯坦人大规模流离失所,1月14日 07:16,
